{"binding":{"adapter":{"id":"test-adapter","profile":"test-profile","version":"1.0.0"},"capabilities":["read.inventory/v1","read.exact_geometry/v1"],"document_binding_digest":"52252b59e3a8194c8f8207870b45f0cdf23f51b8d40fe3bab7266e01f46df5b4","host":{"mode":"full_host","product":"external-host","release":"1.0","runtime":"test-runtime"},"plugin":{"fingerprint":"bb2b5d56f0c113ac2fd57cf5ee7a7fbc39820dc24d4a04d25d5020017999b06c","id":"test-plugin","version":"1.0.0"},"process":{"creation_time_100ns":"123456789","executable_fingerprint":"0d3917d207eee802aa7ba4e352eb8b3990d36cc19cd8753bff2685d8e5595c10","instance_fingerprint":"19ed40bf62c399b8492efda5b9a9184b68cf4d9d4a165b38557b9d14201d0c03","pid":1234,"windows_session_id":1},"protocol_major":1,"protocol_minor":0,"protocol_version":"liang-pingfa/native-bridge/v1","session_binding_digest":"c8c70566a1b3b5aa69e6e608896b4c448b7a95dd300cd65c86771cc59d003308","session_id":"native-session-0123456789abcdef0123456789abcdef","stable_host_binding_digest":"44849f30b1ae40bf7648a49ba3476554c15b03c5845ddd07d26dd1d2ab4d53a1"},"document":{"block_state_digest":"2a12da17d27cd05ab0f3148816c1b4a702334202e82c5ad0dff734cb45db8017","complete_geometry_digest":"5c89f4e80fdf63c0810345f55a84ae411824bedaa68a8ba875d1843b87ebc954","container_order_digest":"981a40fe0d27b4d69b1568f9d7258a4123431b1358e4564e291706848fd3821f","database_instance_fingerprint":"3549b0028b75d981cdda2e573e9cb49dedc200185876df299f912b79f69dabd8","document_state_digest":"f8685cd124959aff65c7373ab755ed2d81f413db5c2f21a273e2c39041edbfe0","layout_state_digest":"7c31f497d1da5b02bb278e75f812c2e45c60a17f705223fd21e7d90b8dcd210b","marker_layer_fingerprint":"b3b6039febc1ab8ac04076e32b7b2af0444a6e76164baba744a23e1e4545786a","marker_style_fingerprint":"edc92dc8b0b3f48a6893d4295c809499417bf4a4bccbef8aebd37877d1c4891c","ordered_entity_digest":"7cf72708d338d3c128b02ed1f1ffc9667c391bea7c471e65302a27849204e16c","protected_order_digest":"ded00edd010fadb8309b9f7060d31e4257285a687e7520b712e2804c4d7d3396","protected_state_digest":"994c3b38565d498b2a888a675e355430ef7b37966cb1420417e0329dcd3f7eb2","revision_fingerprint":"2b214ddf3326016519afcb268f63623b80b91a65265277668e4d020d87dd9078","table_state_digest":"d98a034f5cb8a0e3f07d5d8b5dc3c43723ea8d8b95199e18a82c52e072eca4dd"},"entities":[{"block_path":[],"bounds":{"maximum":["3ff0000000000000","4000000000000000","0000000000000000"],"minimum":["3ff0000000000000","4000000000000000","0000000000000000"]},"geometry_fingerprint":"e72eecc33fec4651452cfd9759678294a88b7e8633053fa4d2dc8b369390225d","handle":"10","height":"4004000000000000","layer":"TEMP","native_type":"DBTEXT","opaque_state_digest":"38f879799a159064f75aed587d5b7b9a2b070918d5378922c4c6b4d4266eaa94","overlay_evidence":{"corresponding_right_absent":true,"left_panel":true,"unique_content":true,"unsupported_data":false,"visible_interference":true},"owner_handle":"AA","position":["3ff0000000000000","4000000000000000","0000000000000000"],"rotation":"0000000000000000","segments":[],"sequence_index":0,"space":{"block_handle":null,"kind":"modelspace","layout_handle":"BB"},"style":"STANDARD","text":"generated"}],"integrity":{"algorithm":"SHA-256","sha256":"94d9b7e367559476f869999b858e8ad6337044fe96e90daad8159ee429f5301e"},"owners":["AA"],"schema_version":"liang-pingfa/native-geometry-export/v1","source":{"byte_size":128,"dwg_header_signature":"AC1032","file_identity_fingerprint":"689f6a627384c7dcb2dcc1487e540223e77bdf9dcd0d8be8a326eda65b0ce9a4","format":"DWG","path_fingerprint":"a0af9f865bf637e6736817f4ce552e4cdf7b8c36ea75bc254c1d1f0af744b5bf","sha256":"41cf6794ba4200b839c53531555f0f3998df4cbb01a4d5cb0b94e3ca5e23947d"}}
